{
  "$schema": "../schema/paket.schema.json",
  "id": "floskeln-en",
  "titel": "Floskeln (Englisch)",
  "gruppe": "schreiben",
  "standardAktiv": true,
  "abschaltbar": false,
  "sprachen": ["en"],
  "beschreibung": "Werbe- und Füllwörter in englischen Texten, wie sie generierte Oberflächen verraten. Ersatz ist eine konkrete Aussage: was passiert, mit Zahl und Einheit.",
  "begriffe": [
    {
      "id": "floskel-en",
      "label": "Floskel",
      "hinweis": "say what happens, with a number and unit",
      "art": "woerter",
      "muster": [
        "seamless\\w*",
        "effortless\\w*",
        "game[- ]?chang(?:er|ers|ing)",
        "cutting[- ]edge",
        "revolutioni[sz](?:e|es|ed|ing)",
        "revolutionary",
        "supercharg\\w*",
        "delv(?:e|es|ed|ing)",
        "unleash\\w*",
        "next[- ]gen(?:eration)?",
        "in\\s+today['’]s",
        "whether\\s+you['’]re",
        "deep[- ]dive\\w*",
        "let['’]s",
        "at\\s+your\\s+fingertips",
        "AI[- ]powered",
        "welcome\\s+(?:to|aboard)"
      ],
      "flags": "i",
      "bereiche": ["ui", "kommentar", "commit", "ki"],
      "beispiele": {
        "treffer": [
          "Seamless sync",
          "Effortlessly organize",
          "A game-changer for notes",
          "cutting-edge models",
          "Revolutionize your workflow",
          "Supercharge your Mac",
          "Let's delve into it",
          "In today's world",
          "Whether you're a writer or a coder",
          "Let’s get started",
          "Welcome to Starter",
          "AI-powered summaries",
          "Unleash your creativity"
        ],
        "erlaubt": ["Sync your notes", "Welcome", "let value = 1"]
      }
    },
    {
      "id": "floskel-en-ui",
      "label": "Floskel in der Oberfläche",
      "hinweis": "say what the feature does, concretely",
      "art": "woerter",
      "muster": [
        "leverag(?:e|es|ed|ing)",
        "unlock(?:s|ed|ing)?",
        "elevat(?:e|es|ed|ing)",
        "empower\\w*",
        "streamlin(?:e|es|ed|ing)",
        "harness(?:es|ed|ing)?",
        "dive\\s+(?:in|into)",
        "(?:your|the|a)\\s+journey",
        "insights?",
        "magic(?:al|ally)?",
        "delightful\\w*",
        "(?:blazing(?:ly)?|lightning)[- ]fast",
        "all[- ]in[- ]one",
        "one[- ]stop",
        "welcome\\s+back",
        "oops",
        "whoops",
        "uh[- ]oh",
        "yay",
        "woo-?hoo",
        "awesome",
        "amazing\\w*",
        "stunning\\w*",
        "powerful\\w*",
        "smart(?:er|est)?",
        "robust\\w*",
        "transformative"
      ],
      "flags": "i",
      "bereiche": ["ui", "ki"],
      "umsetzung": "Nur in Oberfläche und KI-Texten: in Kommentaren und Commits sind Wörter wie unlock oder harness Fachbegriffe.",
      "beispiele": {
        "treffer": [
          "Unlock your potential",
          "Leverage local models",
          "Elevate your writing",
          "Oops, something broke",
          "Powerful shortcuts",
          "Smart suggestions",
          "A robust engine",
          "Harness the power of AI",
          "Dive into your notes",
          "Insights about usage",
          "Magic summaries",
          "blazing-fast search",
          "Welcome back"
        ],
        "erlaubt": ["Use local models", "Smartphone", "Show more", "Transform text"]
      }
    }
  ]
}
